{
  "$schema": "https://json-schema.org/draft/2020-12/schema",
  "$id": "https://github.com/stacknil/telemetry-lab/schemas/case_bundles.schema.json",
  "title": "AI-assisted detection case bundles",
  "description": "Schema for demos/ai-assisted-detection-demo/artifacts/case_bundles.json.",
  "type": "array",
  "minItems": 1,
  "items": {
    "type": "object",
    "additionalProperties": false,
    "required": [
      "case_id",
      "telemetry_classification",
      "first_seen",
      "last_seen",
      "severity",
      "entities",
      "rule_hits",
      "attack_mappings",
      "evidence_highlights",
      "raw_evidence"
    ],
    "properties": {
      "case_id": { "type": "string", "pattern": "^CASE-[0-9]{3}$" },
      "telemetry_classification": { "type": "string", "const": "untrusted_data" },
      "first_seen": { "type": "string", "format": "date-time" },
      "last_seen": { "type": "string", "format": "date-time" },
      "severity": { "type": "string", "enum": ["low", "medium", "high", "critical"] },
      "entities": {
        "type": "object",
        "minProperties": 1,
        "additionalProperties": {
          "type": "array",
          "items": { "type": "string" }
        }
      },
      "rule_hits": {
        "type": "array",
        "minItems": 1,
        "items": { "$ref": "#/$defs/rule_hit" }
      },
      "attack_mappings": {
        "type": "array",
        "minItems": 1,
        "items": { "$ref": "#/$defs/attack_mapping" }
      },
      "evidence_highlights": {
        "type": "array",
        "minItems": 1,
        "items": { "type": "string", "minLength": 1 }
      },
      "raw_evidence": {
        "type": "array",
        "minItems": 1,
        "items": { "$ref": "#/$defs/raw_evidence" }
      }
    }
  },
  "$defs": {
    "attack_mapping": {
      "type": "object",
      "additionalProperties": false,
      "required": ["tactic", "technique_id", "technique_name"],
      "properties": {
        "tactic": { "type": "string", "minLength": 1 },
        "technique_id": { "type": "string", "pattern": "^T[0-9]{4}(\\.[0-9]{3})?$" },
        "technique_name": { "type": "string", "minLength": 1 }
      }
    },
    "rule_hit": {
      "type": "object",
      "additionalProperties": false,
      "required": [
        "hit_id",
        "rule_id",
        "rule_name",
        "severity",
        "event_family",
        "detected_at",
        "event_ids",
        "entity_keys",
        "summary",
        "evidence_highlights",
        "attack_mapping"
      ],
      "properties": {
        "hit_id": { "type": "string", "minLength": 1 },
        "rule_id": { "type": "string", "minLength": 1 },
        "rule_name": { "type": "string", "minLength": 1 },
        "severity": { "type": "string", "enum": ["low", "medium", "high", "critical"] },
        "event_family": { "type": "string", "minLength": 1 },
        "detected_at": { "type": "string", "format": "date-time" },
        "event_ids": {
          "type": "array",
          "minItems": 1,
          "items": { "type": "string", "minLength": 1 }
        },
        "entity_keys": {
          "type": "array",
          "minItems": 1,
          "items": { "type": "string", "minLength": 1 }
        },
        "summary": { "type": "string", "minLength": 1 },
        "evidence_highlights": {
          "type": "array",
          "minItems": 1,
          "items": { "type": "string", "minLength": 1 }
        },
        "attack_mapping": { "$ref": "#/$defs/attack_mapping" }
      }
    },
    "raw_evidence": {
      "type": "object",
      "additionalProperties": false,
      "required": [
        "event_id",
        "timestamp",
        "event_family",
        "principal",
        "src_ip",
        "host",
        "target",
        "action",
        "outcome",
        "url_path",
        "command_line",
        "raw_message",
        "raw_event",
        "entity_keys"
      ],
      "properties": {
        "event_id": { "type": "string", "minLength": 1 },
        "timestamp": { "type": "string", "format": "date-time" },
        "event_family": { "type": "string", "minLength": 1 },
        "principal": { "type": "string" },
        "src_ip": { "type": "string" },
        "host": { "type": "string" },
        "target": { "type": "string" },
        "action": { "type": "string" },
        "outcome": { "type": "string" },
        "url_path": { "type": "string" },
        "command_line": { "type": "string" },
        "raw_message": { "type": "string" },
        "raw_event": {
          "type": "object",
          "additionalProperties": true
        },
        "entity_keys": {
          "type": "array",
          "items": { "type": "string", "minLength": 1 }
        }
      }
    }
  }
}
