[
  {
    "case_id": "CASE-001",
    "telemetry_classification": "untrusted_data",
    "first_seen": "2026-03-27T09:01:55Z",
    "last_seen": "2026-03-27T09:02:20Z",
    "severity": "high",
    "entities": {
      "host": [
        "vpn-gw-01"
      ],
      "principal": [
        "ops_admin"
      ],
      "src_ip": [
        "198.51.100.24"
      ]
    },
    "rule_hits": [
      {
        "hit_id": "AUTH-001-2026-03-27T09:01:55Z",
        "rule_id": "AUTH-001",
        "rule_name": "repeated_failed_logins",
        "severity": "medium",
        "event_family": "auth",
        "detected_at": "2026-03-27T09:01:55Z",
        "event_ids": [
          "auth-001",
          "auth-002",
          "auth-003",
          "auth-004"
        ],
        "entity_keys": [
          "host:vpn-gw-01",
          "principal:ops_admin",
          "src_ip:198.51.100.24"
        ],
        "summary": "4 failed logins for ops_admin from 198.51.100.24 within 5 minutes.",
        "evidence_highlights": [
          "4 auth failures observed for ops_admin from 198.51.100.24."
        ],
        "attack_mapping": {
          "tactic": "Credential Access",
          "technique_id": "T1110",
          "technique_name": "Brute Force"
        }
      },
      {
        "hit_id": "AUTH-002-2026-03-27T09:02:20Z",
        "rule_id": "AUTH-002",
        "rule_name": "successful_login_after_failures",
        "severity": "high",
        "event_family": "auth",
        "detected_at": "2026-03-27T09:02:20Z",
        "event_ids": [
          "auth-001",
          "auth-002",
          "auth-003",
          "auth-004",
          "auth-005"
        ],
        "entity_keys": [
          "host:vpn-gw-01",
          "principal:ops_admin",
          "src_ip:198.51.100.24"
        ],
        "summary": "Successful login for ops_admin followed 4 recent failures from 198.51.100.24.",
        "evidence_highlights": [
          "Successful authentication occurred after 4 recent failures for ops_admin."
        ],
        "attack_mapping": {
          "tactic": "Credential Access",
          "technique_id": "T1078",
          "technique_name": "Valid Accounts"
        }
      }
    ],
    "attack_mappings": [
      {
        "tactic": "Credential Access",
        "technique_id": "T1110",
        "technique_name": "Brute Force"
      },
      {
        "tactic": "Credential Access",
        "technique_id": "T1078",
        "technique_name": "Valid Accounts"
      }
    ],
    "evidence_highlights": [
      "4 auth failures observed for ops_admin from 198.51.100.24.",
      "Successful authentication occurred after 4 recent failures for ops_admin."
    ],
    "raw_evidence": [
      {
        "event_id": "auth-001",
        "timestamp": "2026-03-27T09:00:01Z",
        "event_family": "auth",
        "principal": "ops_admin",
        "src_ip": "198.51.100.24",
        "host": "vpn-gw-01",
        "target": "authentication",
        "action": "login",
        "outcome": "failure",
        "url_path": "",
        "command_line": "",
        "raw_message": "bad_password",
        "raw_event": {
          "event_id": "auth-001",
          "timestamp": "2026-03-27T09:00:01Z",
          "source_type": "auth",
          "user": "ops_admin",
          "src_ip": "198.51.100.24",
          "auth_host": "vpn-gw-01",
          "action": "login",
          "status": "failure",
          "reason": "bad_password"
        },
        "entity_keys": [
          "host:vpn-gw-01",
          "principal:ops_admin",
          "src_ip:198.51.100.24"
        ]
      },
      {
        "event_id": "auth-002",
        "timestamp": "2026-03-27T09:00:33Z",
        "event_family": "auth",
        "principal": "ops_admin",
        "src_ip": "198.51.100.24",
        "host": "vpn-gw-01",
        "target": "authentication",
        "action": "login",
        "outcome": "failure",
        "url_path": "",
        "command_line": "",
        "raw_message": "bad_password",
        "raw_event": {
          "event_id": "auth-002",
          "timestamp": "2026-03-27T09:00:33Z",
          "source_type": "auth",
          "user": "ops_admin",
          "src_ip": "198.51.100.24",
          "auth_host": "vpn-gw-01",
          "action": "login",
          "status": "failure",
          "reason": "bad_password"
        },
        "entity_keys": [
          "host:vpn-gw-01",
          "principal:ops_admin",
          "src_ip:198.51.100.24"
        ]
      },
      {
        "event_id": "auth-003",
        "timestamp": "2026-03-27T09:01:12Z",
        "event_family": "auth",
        "principal": "ops_admin",
        "src_ip": "198.51.100.24",
        "host": "vpn-gw-01",
        "target": "authentication",
        "action": "login",
        "outcome": "failure",
        "url_path": "",
        "command_line": "",
        "raw_message": "bad_password",
        "raw_event": {
          "event_id": "auth-003",
          "timestamp": "2026-03-27T09:01:12Z",
          "source_type": "auth",
          "user": "ops_admin",
          "src_ip": "198.51.100.24",
          "auth_host": "vpn-gw-01",
          "action": "login",
          "status": "failure",
          "reason": "bad_password"
        },
        "entity_keys": [
          "host:vpn-gw-01",
          "principal:ops_admin",
          "src_ip:198.51.100.24"
        ]
      },
      {
        "event_id": "auth-004",
        "timestamp": "2026-03-27T09:01:55Z",
        "event_family": "auth",
        "principal": "ops_admin",
        "src_ip": "198.51.100.24",
        "host": "vpn-gw-01",
        "target": "authentication",
        "action": "login",
        "outcome": "failure",
        "url_path": "",
        "command_line": "",
        "raw_message": "bad_password",
        "raw_event": {
          "event_id": "auth-004",
          "timestamp": "2026-03-27T09:01:55Z",
          "source_type": "auth",
          "user": "ops_admin",
          "src_ip": "198.51.100.24",
          "auth_host": "vpn-gw-01",
          "action": "login",
          "status": "failure",
          "reason": "bad_password"
        },
        "entity_keys": [
          "host:vpn-gw-01",
          "principal:ops_admin",
          "src_ip:198.51.100.24"
        ]
      },
      {
        "event_id": "auth-005",
        "timestamp": "2026-03-27T09:02:20Z",
        "event_family": "auth",
        "principal": "ops_admin",
        "src_ip": "198.51.100.24",
        "host": "vpn-gw-01",
        "target": "authentication",
        "action": "login",
        "outcome": "success",
        "url_path": "",
        "command_line": "",
        "raw_message": "mfa_bypass_not_required",
        "raw_event": {
          "event_id": "auth-005",
          "timestamp": "2026-03-27T09:02:20Z",
          "source_type": "auth",
          "user": "ops_admin",
          "src_ip": "198.51.100.24",
          "auth_host": "vpn-gw-01",
          "action": "login",
          "status": "success",
          "reason": "mfa_bypass_not_required"
        },
        "entity_keys": [
          "host:vpn-gw-01",
          "principal:ops_admin",
          "src_ip:198.51.100.24"
        ]
      },
      {
        "event_id": "auth-006",
        "timestamp": "2026-03-27T09:03:10Z",
        "event_family": "auth",
        "principal": "analyst1",
        "src_ip": "203.0.113.10",
        "host": "vpn-gw-01",
        "target": "authentication",
        "action": "login",
        "outcome": "success",
        "url_path": "",
        "command_line": "",
        "raw_message": "normal_login",
        "raw_event": {
          "event_id": "auth-006",
          "timestamp": "2026-03-27T09:03:10Z",
          "source_type": "auth",
          "user": "analyst1",
          "src_ip": "203.0.113.10",
          "auth_host": "vpn-gw-01",
          "action": "login",
          "status": "success",
          "reason": "normal_login"
        },
        "entity_keys": [
          "host:vpn-gw-01",
          "principal:analyst1",
          "src_ip:203.0.113.10"
        ]
      }
    ]
  },
  {
    "case_id": "CASE-002",
    "telemetry_classification": "untrusted_data",
    "first_seen": "2026-03-27T09:11:10Z",
    "last_seen": "2026-03-27T09:11:10Z",
    "severity": "medium",
    "entities": {
      "host": [
        "portal-01"
      ],
      "src_ip": [
        "203.0.113.77"
      ],
      "target": [
        "/.env",
        "/admin",
        "/wp-admin"
      ]
    },
    "rule_hits": [
      {
        "hit_id": "WEB-001-2026-03-27T09:11:10Z",
        "rule_id": "WEB-001",
        "rule_name": "sensitive_path_scan",
        "severity": "medium",
        "event_family": "web",
        "detected_at": "2026-03-27T09:11:10Z",
        "event_ids": [
          "web-001",
          "web-002",
          "web-004"
        ],
        "entity_keys": [
          "host:portal-01",
          "src_ip:203.0.113.77",
          "target:/.env",
          "target:/admin",
          "target:/wp-admin"
        ],
        "summary": "3 requests for sensitive paths from 203.0.113.77 against portal-01.",
        "evidence_highlights": [
          "Sensitive paths requested: /.env, /admin, /wp-admin."
        ],
        "attack_mapping": {
          "tactic": "Reconnaissance",
          "technique_id": "T1595",
          "technique_name": "Active Scanning"
        }
      }
    ],
    "attack_mappings": [
      {
        "tactic": "Reconnaissance",
        "technique_id": "T1595",
        "technique_name": "Active Scanning"
      }
    ],
    "evidence_highlights": [
      "Sensitive paths requested: /.env, /admin, /wp-admin.",
      "Prompt-like text appeared in telemetry and was retained as untrusted evidence only."
    ],